{
  "schema": "aether.skill-evaluations/v2",
  "skill": "create-design-document",
  "version": "1.1.0",
  "cases": [
    {
      "id": "valid-experience-source-set",
      "description": "Create a valid DESIGN.md from sufficient upstream evidence.",
      "category": "positive",
      "trigger": "should-trigger",
      "expected": [
        "Answers the primary experience question",
        "Preserves accessibility and agency",
        "Respects document boundaries",
        "Passes specification acceptance criteria"
      ]
    },
    {
      "id": "implementation-dominated-input",
      "description": "Input consists primarily of components, token values, or framework code.",
      "category": "boundary",
      "trigger": "should-trigger",
      "expected": [
        "Separates semantic intent from implementation",
        "Excludes accidental framework coupling",
        "Retains relevant design evidence",
        "Explains downstream implementation ownership"
      ]
    },
    {
      "id": "conflicting-product-identities",
      "description": "Multiple products have distinct visual systems and partially conflicting patterns.",
      "category": "boundary",
      "trigger": "should-trigger",
      "expected": [
        "Preserves legitimate product individuality",
        "Identifies shared human-centered guarantees",
        "Does not force visual sameness",
        "Surfaces unresolved canonicalization decisions"
      ]
    },
    {
      "id": "accessibility-conflict",
      "description": "A proposed aesthetic or motion rule conflicts with accessibility or user control.",
      "category": "boundary",
      "trigger": "should-trigger",
      "expected": [
        "Prioritizes accessibility and meaningful control",
        "Identifies the conflict explicitly",
        "Rejects or constrains the unsafe rule",
        "Records a compliant alternative or open decision"
      ]
    },
    {
      "id": "design-insufficient-evidence",
      "description": "Required human-centered design evidence is incomplete or absent.",
      "category": "insufficient-evidence",
      "trigger": "should-trigger",
      "tags": [
        "evidence",
        "blocked"
      ],
      "expected": [
        "Does not invent design intent without evidence",
        "Labels assumptions and evidence gaps",
        "Reports blocked or provisional completion",
        "Requests the missing upstream design context"
      ],
      "prohibited": [
        "Fabricating experience intent without evidence"
      ]
    },
    {
      "id": "design-negative-trigger",
      "description": "The request is for implementation details such as CSS tokens or component code, not experience design intent.",
      "category": "negative",
      "trigger": "should-not-trigger",
      "tags": [
        "routing"
      ],
      "expected": [
        "Declines to use this skill for implementation-level requests",
        "Identifies that DESIGN.md captures experience intent, not implementation",
        "Routes implementation work to the appropriate artifact",
        "Avoids producing a DESIGN.md populated with implementation details"
      ],
      "prohibited": [
        "Creating DESIGN.md content from component specifications or token tables"
      ]
    }
  ]
}
