{
  "schema": "aether.skill-evaluations/v2",
  "skill": "github-issue-authoring",
  "version": "1.2.0",
  "cases": [
    {
      "id": "spec-to-issue",
      "description": "Evidence-backed requirements must become one copy-ready implementation issue.",
      "category": "positive",
      "trigger": "should-trigger",
      "expected": [
        "Extracts the real problem and desired outcome",
        "Produces scoped issue content with observable acceptance criteria",
        "Keeps implementation guidance evidence-backed",
        "Preserves copy-ready formatting"
      ]
    },
    {
      "id": "update-existing-issue",
      "description": "An existing issue draft must be revised after new audit evidence changes scope or dependencies.",
      "category": "positive",
      "trigger": "should-trigger",
      "tags": [
        "update"
      ],
      "expected": [
        "Updates scope and validation to match the new evidence",
        "Keeps earlier intent only when still supported",
        "Makes the delta from the prior draft visible rather than silently rewriting history"
      ]
    },
    {
      "id": "missing-repository-evidence",
      "description": "The request provides a brain dump but no reliable repository evidence for paths, commands, or dependencies.",
      "category": "insufficient-evidence",
      "trigger": "should-trigger",
      "expected": [
        "Does not fabricate exact repository details",
        "Labels assumptions and provisional guidance",
        "Requests or records the missing evidence needed for a precise issue"
      ]
    },
    {
      "id": "bundling-too-much-work",
      "description": "The draft issue mixes several independently shippable outcomes and a migration sequence.",
      "category": "boundary",
      "trigger": "should-trigger",
      "expected": [
        "Splits work into an ordered batch or roadmap when needed",
        "Keeps each issue independently reviewable",
        "Does not hide sequencing risk inside one oversized issue"
      ]
    },
    {
      "id": "implement-instead-negative-trigger",
      "description": "The user wants the code changed now rather than an issue drafted.",
      "category": "negative",
      "trigger": "should-not-trigger",
      "expected": [
        "Declines to substitute issue authoring for immediate implementation",
        "Routes toward implementation work or another execution skill",
        "Avoids returning only issue text when direct changes were requested"
      ],
      "prohibited": [
        "Replacing an explicit implementation request with issue text only"
      ]
    },
    {
      "id": "local-title-discovery",
      "description": "A fresh session receives local AGENTS guidance selecting the policy and a reviewed checkpoint subject.",
      "category": "positive",
      "trigger": "should-trigger",
      "expected": [
        "Follows the local skill pointer to the immutable selection and selected source artifacts",
        "Preserves the reviewed subject and checkpoint identifiers",
        "Composes Egolint only through an already authorized executor",
        "Reports proposed validation and provider label availability separately"
      ]
    },
    {
      "id": "unavailable-title-evidence",
      "description": "The installed skill, source artifact, tool, execution permission, or complete provider label evidence is unavailable.",
      "category": "insufficient-evidence",
      "trigger": "should-trigger",
      "expected": [
        "Returns a useful draft with the exact unavailable evidence stated",
        "Does not invent a passing validator result or silently fall back to a moving source",
        "Does not treat unknown provider labels as an empty complete set"
      ]
    },
    {
      "id": "conflicting-title-labels",
      "description": "An existing issue has absent, multiple, or unsupported type labels.",
      "category": "boundary",
      "trigger": "should-trigger",
      "expected": [
        "Reports needs-classification, conflict, or unsupported-type using the selected semantics",
        "Does not infer classification from the current emoji or silently change labels"
      ]
    },
    {
      "id": "stale-title-evidence",
      "description": "The available Egolint report uses a different source pin or the provider title/labels changed after inspection.",
      "category": "boundary",
      "trigger": "should-trigger",
      "expected": [
        "Rejects mismatched report provenance",
        "Refreshes provider evidence and revalidates before proposing a current write",
        "Does not equate source acceptance, repository adoption, and validation"
      ]
    },
    {
      "id": "reviewed-title-migration",
      "description": "An existing title contains an unfamiliar prefix and an accepted checkpoint identifier.",
      "category": "positive",
      "trigger": "should-trigger",
      "expected": [
        "Preserves wording and identifiers until an explicit reviewed subject is available",
        "Uses the same reviewed subject for repeat formatting without duplicating the prefix",
        "Does not reconstruct parent/child relationships by parsing the title"
      ]
    }
  ]
}
